<xsd:schema xmlns:xsd='http://www.w3.org/2001/XMLSchema'
           targetNamespace='http://cl/bee/genfrmjava/rangedef/schema'
                     xmlns='http://cl/bee/genfrmjava/rangedef/schema'>

 <!-- ========================================================================================== ==
   == ranges
   == ========================================================================================== -->

 <xsd:element name='ranges'>

  <xsd:complexType>

   <xsd:sequence>
     <xsd:element ref='field' minOccurs='0' maxOccurs='unbounded'/>
   </xsd:sequence>

  </xsd:complexType>

 </xsd:element>

 <!-- ========================================================================================== ==
   == field
   == ========================================================================================== -->

 <xsd:element name='field'>

  <xsd:complexType>

    <xsd:attribute name='name'       type='xsd:string' use='required'/>
    <xsd:attribute name='domain'     type='xsd:string' use='required'/>
    <xsd:attribute name='system'     type='xsd:string' default=''/>
    <xsd:attribute name='registry'   type='xsd:string' default=''/>
    <xsd:attribute name='table'      type='xsd:string' default=''/>
    <xsd:attribute name='validation' type='xsd:string' default=''/>
    <xsd:attribute name='search'     type='xsd:string' default=''/>

  </xsd:complexType>

 </xsd:element>

</xsd:schema>