<?xml version = "1.0" encoding = "ISO-8859-1" ?>

<ranges xmlns              = "http://cl/bee/genfrmjava/rangedef/schema"
        xmlns:xsi          = "http://www.w3.org/2001/XMLSchema-instance"
        xsi:schemaLocation = "http://cl/bee/genfrmjava/rangedef/schema rangedef.xsd">

  <field name="ACT-IND-VIGE" domain="INDVIGE" system="TAB" registry="ACT" />
  <field name="BCO-IND-VIGE" domain="INDVIGE" system="TAB" registry="BCO" />
  <field name="COM-COD-DPTO" domain="CODDPTO" system="TAB" registry="DPT" />
  <field name="COM-COD-PAIS" domain="CODPAIS" system="TAB" registry="PAI" />
  <field name="COM-COD-PRVC" domain="CODPRVC" system="TAB" registry="PRV" />
  <field name="COM-COD-REGI" domain="CODREGI" system="TAB" registry="REG" />
  <field name="COM-IND-VIGE" domain="INDVIGE" system="TAB" registry="COM" />
  <field name="CYA-IND-TCYA" domain="CODCYA" />
  <field name="FRM-IND-LOGA" domain="INDLOGA" system="GNS" registry="TAB" />
  <field name="IVB-COD-DPTO" domain="CODDPTO" system="TAB" registry="DPT" />
  <field name="IVB-COD-TTAB" domain="CODTTA1" system="TAB" registry="IVB" />
  <field name="IVB-IND-VIGE" domain="INDVIGE" system="TAB" registry="IVB" />
  <field name="OFI-COD-COMU" domain="CODCOMU" system="TAB" />
  <field name="OFI-COD-PLZA" domain="CODPLZA" system="TAB" />
  <field name="OPC-COD-COOC" domain="CODCOOC" />
  <field name="OPC-COD-TTRN" domain="CODCNL" />
  <field name="OPC-COD-VCOC" domain="CODVCOC" />
  <field name="PAI-IND-VIGE" domain="INDVIGE" system="TAB" registry="PAI" />
  <field name="PZA-COD-BNCO" domain="CODCBCO" system="TAB" registry="PZA" />
  <field name="PZA-IND-VIGE" domain="INDVIGE" system="TAB" registry="PZA" />
  <field name="ROP-COD-FORM" domain="TABFOR" />
  <field name="ROP-COD-TCAP" domain="TABCAP" />
  <field name="ROR-COD-CNAL" domain="CODCNL" />
  <field name="ROR-COD-COOC" domain="CODCOOC" />
  <field name="ROR-COD-VCOC" domain="CODVCOC" />
  <field name="ROR-IND-TCYA" domain="CODCYA" />
  <field name="SVC-IND-VIGE" domain="INDVIGE" system="TAB" registry="SVC" />
  <field name="TAB-COD-CTAB" domain="CODCTAB" system="TAB" registry="TAB" />
  <field name="TIO-IND-ACPA" domain="INDACPA" system="TAB" registry="TIO" />
  <field name="TIO-IND-TCOL" domain="INDTCOL" system="TAB" registry="TIO" />
  <field name="TIO-IND-VIGE" domain="INDVIGE" system="TAB" registry="TIO" />
  <field name="USR-COD-AGES" domain="CODAGES" registry="USR" />
  <field name="USR-COD-BNCA" domain="CODBNCA" system="TAB" registry="USR" />
  <field name="USR-COD-CNEG" domain="CODCNEG" system="TAB" registry="USR" />
  <field name="USR-COD-CUSR" domain="CODCUSR" system="TAB" registry="USR" />
  <field name="USR-COD-OFUS" domain="CODOFIC" registry="USR" />
  <field name="USR-COD-PLAT" domain="CODPLAT" system="TAB" registry="USR" />
  <field name="USR-COD-REGL" domain="CODREGL" system="TAB" registry="USR" />
  <field name="USR-COD-TEJE" domain="CODTEJE" system="TAB" registry="USR" validation="VALCOD" search="BUSTAB" />
  <field name="USR-COD-TTAB" domain="CODTTAB" system="TAB" registry="USR" />
  <field name="USR-COD-UBIC" domain="CODUBIC" system="TAB" registry="USR" />
  <field name="USR-IND-VIGE" domain="INDVIGE" system="TAB" registry="USR" />
  <field name="VLR-IND-VIGE" domain="INDVIGE" system="TAB" registry="VLR" />
  <field name="WFC-COD-ACTC" domain="CODACT" />
  <field name="WFC-COD-CFMN" domain="CODVCOC" />
  <field name="WFC-COD-CVTE" domain="CODVCOC" />
  <field name="WFC-COD-EBCI" domain="CODTDU" />
  <field name="WFC-COD-EBCS" domain="CODTDU" />
  <field name="WFC-COD-OFCV" domain="CODOFIC" />
  <field name="WFC-COD-PTRF" domain="CODPTR" />
  <field name="WFC-COD-SBCI" domain="CODOFIC" />
  <field name="WFC-COD-SBCS" domain="CODOFIC" />
  <field name="WFC-MSC-STAT" domain="CODSTT" />
</ranges>
